{
  "kind": "kmin.reference_binding",
  "schema_version": "2.0.0",
  "id": "binding-1",
  "extensions": {},
  "required_features": [],
  "project_id": "proj-1",
  "subject_id": "subject-1",
  "image_media_id": "image-1",
  "content_digest": {
    "algorithm": "sha256",
    "hex": "abababababababababababababababababababababababababababababababab"
  },
  "role": "identity",
  "segment_ids": [
    "seg-1"
  ],
  "useful_ranges": [],
  "appearance_state_id": "appearance-1",
  "description": "User supplied identity",
  "approved": true,
  "revision": 1,
  "retention_instructions": "Keep appearance"
}
